PartyName,PartyTaxCode,PartyLogo,PLFirstName,PLLastName,PartyFoundingDate (dd-mm-yy),PartyPolicy
ประชาชาติไทย,187,IMG74,วันมูหะมัดนอร์,มะทา,31-10-61,"แก้ปัญหาของชาติด้วยวิถีทางประชาธิปไตยอันมีพระมหากษัตริย์ทรงเป็นประมุขที่ธำรงไว้ซึ่งหลักนิติธรรม ส่งเสริมสังคมพหุวัฒนธรรมที่เคารพให้เกียรติในความแตกต่างหลากหลายทางวัฒนธรรม ยกเลิกและปฏิรูปกฎหมาย กระบวนการยุติธรรม ระบบงบประมาณและภาษีอากรให้เกิดความเป็นธรรม ส่งเสริมระบบรัฐสวัสดิการด้านการศึกษา การรักษาพยาบาลฟรี ระบบบำนาญและสวัสดิการ (เบี้ยผู้สูงอายุ (ปี) 3,000 บาท / เดือน) ยกระดับโครงสร้างพื้นฐานด้านสาธารณูปโภคและคมนาคม แก้ไขปัญหาความยากจน หนี้สิน ความเหลื่อมล้ำทั้งด้านเศรษฐกิจ, สิทธิเสรีภาพ, กฎหมาย, ศักดิ์ศรีและเชิงพื้นที่ ขจัดการทุจริต เกษตรกรมีที่ดินทำกินและเป็นเจ้าของกรรมสิทธิ์ในที่ดิน แก้ไขปัญหาน้ำทั้งระบบ สินค้าเกษตรให้ขายได้ราคาสูงสุด ส่งเสริมการท่องเที่ยวและการกีฬา แก้ปัญหายาเสพติด"
แผ่นดินธรรม,188,IMG75,กรณ์,มีดี,02-11-61,ธนาคารพุทธธนาคารเพื่อชาวพุทธ | บัญญัติให้พระพุทธศาสนาเป็นศาสนาประจำชาติ | เพิ่มวิชาสมาธิภาวนาเป็นวิชาบังคับในโรงเรียนทุกระดับ | ยกเลิกกองทุนน้ำมันดีเซลและลดราคาน้ำมันทุกชนิด | 1 จังหวัด 1 โรงพยาบาลแพทย์แผนไทย | ตั้งกระทรวงชาวนาและกระทรวงยางพารา | แก้กฎหมายความเร็วรถให้เหมาะกับสภาพรถและถนนปัจจุบัน | พักใช้ข้อมูลเครดิตบูโร 1 ปี | นิคมไทยพุทธ 3 จังหวัดชายแดนใต้ | ให้โรงเรียนพระปริยัติสามัญเป็นโรงเรียนของรัฐ
คลองไทย,189,IMG76,สายัณห์,อินทรภักดิ์,02-11-61,ผลักดันโครงการคลองไทยด้วยการเสนอร่างพระราชบัญญัติคลองไทยในสภาผู้แทนราษฎรให้มีกฎหมายรองรับโครงการคลองไทย เพื่อนำรายได้จากโครงการคลองไทยไปพัฒนาเศรษฐกิจและสังคมของประเทศให้มีความมั่นคง มั่งคั่ง ยั่งยืน | แก้ไขปัญหาของประเทศด้านพลังงาน ที่ดินทำกิน ยาเสพติด การทุจริตคอรัปชั่น การค้ามนุษย์ | พัฒนาประเทศตามแผนพัฒนาเศรษฐกิจและสังคมแห่งชาติและแผนงบประมาณรายจ่ายของรัฐให้เกิดประสิทธิภาพสูงสุด
ประชาธรรมไทย,190,IMG77,พิเชษฐ,สถิรชวาล,02-11-61,นโยบายยกระดับคุณภาพชีวิตประชาชนและเพิ่มรายได้ให้กับประชาชนอย่างเท่าเทียมกันในด้านการศึกษา สาธารณสุข ประกันอนาคตชีวิตให้แก่เด็กแรกเกิด สร้างความเสมอภาคและสิทธิเสรีภาพอันเท่าเทียมกัน ให้กับประชาชนทุกเพศ ประกอบกับเพิ่มคุณภาพชีวิตให้กับคนพิการและผู้สูงวัยในด้านการศึกษา คนไทยต้องได้เรียนฟรีอย่างคุณภาพ อย่างเท่าเทียมกัน ตลอดจนพัฒนาคุณภาพชีวิตครูและบุคลากรทางการศึกษาทั้งภาครัฐและเอกชน ด้านเศรษฐกิจ การเพิ่มมูลค่าให้กับสินค้าเกษตร รวมถึงสนับสนุนทุกกลุ่มอาชีพ เปิดตลาดส่งออกใหม่ ขยายตลาดการท่องเที่ยวให้ดีขึ้น ขยายความสัมพันธ์ที่ดีขึ้นกับนานาประเทศเพื่อเพิ่มตลาดการลงทุน การส่งออก และการท่องเที่ยว
ประชานิยม,191,IMG78,ยงยุทธ,เทพจำนงค์,07-11-61,"ให้นายจ้างจ่ายเงินประกันสังคมแทนลูกจ้างทั้งหมด ยกเลิกหักเงินเดือนลูกจ้างร้อยละ 5 ที่นำส่งประกันสังคมสูงสุด 9,000 บาท / คน / ปี, ค่าแรงขั้นต่ำ 360 บาท / คน / วัน ทั่วประเทศ, หยุดกองทัพซื้ออาวุธ 10 ปี นำเงิน 400,000 ล้านบาท ไปพัฒนาประเทศ, เปลี่ยนงบซื้อรถถัง ไปซื้อรถโดยสารปรับอากาศ 10,000 คัน เปลี่ยนงบซื้อรถถัง ไปซื้อรถไถนา, รถดำนา, รถเกี่ยวนวดข้าวประจำหมู่บ้าน และรถตัดอ้อยให้ชาวนา ชาวไร่ใช้ฟรี รับซื้อน้ำยางพาราสด 80 บาท / กิโลกรัม, ผลปาล์มสด 4 บาท / กิโลกรัม, สร้างโรงงานผลิตหมอนยางพารา, ยางรถยนต์ สร้างอาคารรักษาพยาบาลในโรงพยาบาลเพิ่ม 100,000 เตียง, ธนาคารครู, รถตู้ รับ - ส่ง นักเรียน ประจำตำบล"
พลังประชารัฐ,192,IMG79,อุตตม,สาวนายน,07-11-61,สวัสดิการประชารัฐ เพื่อขจัดความเหลื่อมล้ำผ่านบัตรประชารัฐ การให้สวัสดิการรายกลุ่ม ลดหนี้สร้างเงินออม และช่วยเหลือด้านที่อยู่อาศัยและที่ทำกิน | สังคมประชารัฐ เพื่อสร้างสังคมสงบสุข เข้มแข็งแบ่งปัน ผ่านการพัฒนา การศึกษา การกระจายความเจริญ การสร้างเมืองอัจฉริยะสีเขียว การพัฒนาชุมชนสีขาว กรุงเทพ 5.0 | เศรษฐกิจประชารัฐ เพื่อสร้างความสามารถและโอกาสที่เท่าเทียม ผ่านการยกระดับความสามารถผู้ผลิต การเกษตรประชารัฐ การท่องเที่ยวชุมชนและเศรษฐกิจสร้างสรรค์ เศรษฐกิจชีวภาพ การพัฒนาโครงสร้างพื้นฐานแห่งอนาคต และการลดอุปสรรคในการดำเนินธุรกิจ
เศรษฐกิจใหม่,193,IMG80,มิ่งขวัญ,แสงสุวรรณ,08-11-61,"ได้เวลาความสุขของคนไทยทั้งประเทศด้วยระบบเศรษฐกิจใหม่ ( วางตำแหน่งประเทศไทย เพื่อความได้เปรียบและมีศักยภาพสูงในการแข่งขัน, หารายได้เข้าประเทศโดยสร้างระบบการเงินเสรี, ศูนย์กลางการเงิน, พลังงาน, การแพทย์ และอื่นๆ, ดูแลความมั่นคงปลอดภัยในชีวิตและทรัพย์สินของคนไทย, สร้างความสัมพันธ์อันดี ทั้งการค้า การลงทุน การทูตกับนานาชาติ)"
ไทยรุ่งเรือง,194,IMG81,ฉัตรชัย,แนวพญา,08-11-61,คุณธรรมนำการเมืองพูดความจริง ทำในสิ่งที่เป็นไปได้ ทำทุกเรื่องเพื่อประเทศชาติพัฒนาและประชาชนมีความสุข ให้ประชาชนมีส่วนร่วมในการนำเสนอนโยบายและพร้อมที่จะนำไปปฏิบัติ
พลังรัก,195,IMG82,ภรัณ,กิตติวัฒน์,21-11-61,คงไว้ซึ่งระบอบประชาธิปไตยอันมีพระมหากษัตริย์เป็นประมุข พัฒนาคนไทยให้มีศักดิ์ศรี มีภาวะผู้นำเป็นคนดี มีความรู้ความสามารถ และศีลธรรมอันดี สร้างความรัก สามัคคี ส่งเสริมธุรกิจชุมชน โดยประชาชน และเอกชนให้มีส่วนร่วมในการบริหารจัดการในการสร้างรายได้ระดับชุมชนและระดับชาติ แก้ปัญหาเศรษฐกิจตามศาสตร์พระราชา
ชาติพันธุ์ไทย,196,IMG83,พลศุภรักษ์,ศิริจันทรานนท์,21-11-61,ธำรงไว้ซึ่งการปกครองในระบอบประชาธิปไตยอันมีพระมหากษัตริย์เป็นประมุข ยึดมั่นในสถาบันชาติ ศาสนา และพระมหากษัตริย์ มุ่งเน้นความรู้รัก สามัคคีภายในชาติ ที่มีความหลากหลายทางชาติพันธุ์ซึ่งทุกคนเป็นคนไทยเหมือนกันมีความเสมอภาค เท่าเทียมและยุติธรรมไม่มีการแบ่งแยกแตกต่างระหว่างกัน ส่งเสริมการมีส่วนร่วมทุกภาคส่วน | กระจายอำนาจสู่ท้องถิ่นโดยยึดถือฐานรากแห่งสังคม อัตลักษณ์และวัฒนธรรมที่หลากหลาย | ปรับปรุงแก้ไขกฎหมายและการบริหารราชการแผ่นดินเพื่อนำไปสู่การสร้างสังคมแห่งโอกาสและความเท่าเทียมเสมอภาคและเป็นธรรม พร้อมที่จะก้าวเดินไปด้วยกัน
ภูมิพลังเกษตรกรไทย,197,IMG84,คำนึง,พุฒหอม,26-11-61,ควบคุมต้นทุนการผลิตให้ต่ำกว่าราคาผลผลิต นำนวัตกรรมเทคโนโลยีการเกษตรสมาร์ทฟาร์มเมอร์มาช่วยรักษาคุณภาพผลผลิต จัดสรรการใช้น้ำให้พอเพียง จัดสรรทุนการศึกษาให้บุตรหลานเกษตรกรเรียนฟรีถึงปริญญาโทในสถานศึกษาของรัฐ รักษาพยาบาลฟรี หัวหน้าครอบครัวเกษตรกรมีสวัสดิการให้สามารถเลี้ยงครอบครัวได้ภายหลังอายุ 60 ปี นำเกษตรอินทรีย์ดูแลชีวิตของสังคม สนับสนุนส่งเสริมให้มีการรวมตัวของเกษตรกรเพื่อลดต้นทุนการผลิต และใช้ทรัพยากรปัจจัยการผลิตร่วมกัน ลดหนี้ของเกษตรกรให้เป็นศูนย์ภายใน 4 ปี
พลังสังคม,198,IMG85,วิฑูรย์,ชลายนนาวิน,26-11-61,นโยบายแก้ไขปัญหาที่ดินทำกินของราษฎร ให้มีเอกสารสิทธิ์โดยชอบตามกฎหมาย ทุกครัวเรือนโดยปรับปรุงระเบียบและข้อกฎหมายที่เกี่ยวข้อง | นโยบายสหกรณ์พรรคพลังสังคมที่เกี่ยวกับเรื่องที่ดินทำกิน | แก้ไข ปรับปรุงกฎหมาย เครดิตบูโร โดยการผลักดันให้มิให้โดน Blacklist โดยลดเงื่อนไขลง 1 ล้านบาท มิให้เป็นหนี้ | ตั้งศูนย์รับเรื่องราวร้องทุกข์ ทั้ง 4 ภาค ในทุกเรื่องโดยเน้นที่ดินทำกิน
พลังแรงงานไทย,199,IMG86,พิเชษฐ์,ภูแก้ว,26-11-61,ยกเลิกกฎหมายหนี้สินที่ไม่เป็นธรรม | ให้ที่ทำกินครอบครัวละ 5 ไร่ | รักษาพยาบาลฟรี | เรียนฟรีชั้นอนุบาลถึงปริญญา | ยกเลิกหนี้สิน กยส. และ เครดิตบูโร | ยกระดับเกษตรกรและแรงงานสู่สากล
พลังไทสร้างชาติ,200,IMG87,ณภัคธร,ชัยสงคราม,26-11-61,แปลงวุฒิการศึกษาเป็นทุนทรัพย์ เป็นพรรคของเกษตรกร และคนฐานราก สร้างความเท่าเทียมทางสังคม 1 แพทย์ 1 โรงพยาบาลส่งเสริมสุขภาพตำบล สร้างตลาดทุน เพื่อเกษตรกร
พลังศรัทธา,201,IMG88,อนันตร์,บุญรำไพ,26-11-61,เรียนฟรีจนถึงมัธยมปลาย อาหารกลางวันฟรี รถไฟชั้น 3 ฟรี รถเมล์ฟรีเชื่อมโยงทุกภูมิภาค ที่ทำกินฟรี ออกเอกสารสิทธิเสมอภาคปุ๋ยชีวภาพฟรี รักษาพยาบาลฟรี มีครูสอนภาษาต่างประเทศให้นักเรียนและประชาชนฟรี จัดให้มีคลินิกให้คำปรึกษาปัญหาแก้จนฟรี ปลูกไม้ยืนต้นในที่ตนเองได้ทุกชนิดเป็นไม้เศรษฐกิจปลูกได้ตัดได้ ติดตั้งแผงโซล่าเซลฟรี พักหนี้เกษตรกร หนี้ กยศ. และหนี้ราชการ 4 ปี ให้บำนาญราชการตกทอดถึงลูกหลาน และคู่สมรส
พลังแผ่นดินทอง,202,IMG89,อนุวัฒน์,วิใจเงิน,03-12-61,นโยบายและยุทธศาสตร์พรรคพลังแผ่นดินทองการบริหารประเทศมั่งคง มั่งคั่ง และยั่งยืน ระยะ 4 ปี (พ.ศ.2562-2565) รวม 5 นโยบาย 73 แนวทางพัฒนา ดังนี้ นโยบายที่ 1 พัฒนาอาชีพรายได้ของประชาชนเพื่อคุณภาพชีวิตที่ดี นโยบายที่ 2 พัฒนาคนไทย 4.0 เพื่ออนาคตประเทศไทย นโยบายที่ 3 ลดความเหลื่อมล้ำ ความยากจนและจัดสวัสดิการเพื่อคนไทยอยู่ดีมีสุขทั่วหน้า นโยบายที่ 4 ยกระดับการพัฒนาภาคและพื้นที่เป้าหมายทางเศรษฐกิจเพื่อการแข่งขัน นโยบายที่ 5 พัฒนาสร้างอนาคตประเทศไทย
กลาง,203,IMG90,ชุมพล,ครุฑแก้ว,11-12-61,พรรคกลางนำเสนอเทคโนโลยีเพื่อประชาธิปไตย ด้วยประชาธิปไตยทางตรง อำนาจจะอยู่ในมือ(ถือ)ของประชาชนตลอดไป [ปชช.มีส่วนร่วมได้ในทุกการตัดสินใจและเป็นผู้ลงประชามติได้ปีละหลายครั้ง รวมถึงการเสนอนโยบายเองได้ด้วยปลายนิ้ว] เราไม่มีนายทุนชี้นำเบื้องหลัง เราเป็นจิตอาสาจากหลากหลายอาชีพ เสียสละเข้ามาร่วมงาน ก้าวข้ามความขัดแย้ง พัฒนาอย่างสร้างสรรค์ เน้นแก้ปัญหาอย่างยั่งยืน มุ่งสร้างความเที่ยงธรรมในสังคม และ ส่งเสริมการมีส่วนร่วม/รับฟัง/กระจายอำนาจ ส.ส.พรรคกลางจะทำงานต่อเนื่องช่วยเหลือ ปชช. ผ่านศูนย์ร้องเรียน ที่จะช่วยให้คำปรึกษาด้านกฎหมายด้วยเครือข่ายจิตอาสา ส.ส.พรรคกลางจะสอบถามความเห็นสมาชิก/ปชช. ก่อนเข้าไปอภิปราย/ออกเสียงในสภา “ปชช.ทุกคนเป็นนักการเมืองได้”
พลังเพื่อไทย,204,IMG91,เอกวรพงศ์,อำนวยทรัพย์,11-12-61,NULL
ประชาไทย,205,IMG92,บุญยงค์,จันทร์แสง,20-12-61,ก้าวข้ามความขัดแย้ง เชื่อมโยงใจ หลอมรวมไทยทั้งแผ่นดิน ความอยู่รอดประเทศไทยต้องมาก่อน หยุดอาฆาต | สหกรณ์แบ่งปันสร้างสรรค์วิถีไทย แผนพัฒนาอาชีพแห่งชาติตรงยุคสมัยคนไทยมีงานทำ 1 หมู่บ้าน 1 วิสาหกิจ | พลเมืองดีมีที่อยู่ที่ทำกิน ขจัดสิ้นคอร์รัปชัน ยาเสพติด ฟื้นฟูดูแลสิ่งแวดล้อม หยุดประชานิยม สอนคนให้ทำกิน | ลดเหลื่อมล้ำสร้างความเท่าเทียมในทุกด้านตั้งแต่ตั้งครรภ์จนถึงจากไปอย่างสงบอาชีวะจะสร้างชาติ เรียนฟรีมีเงินใช้ | อินเทอร์เน็ตทั่วทิศ กับชีวิตที่รอบรู้ โรงเรียนผู้สูงวัยใส่ใจความรู้ สุขกายสุขใจ เงินทองเหลือใช้ คลังความรู้สู่ชุมชน | ชีวิตปลอดภัย ใส่ใจสิ่งแวดล้อม พลังงานปลอดภัย สดใสสะอาด ใช้อย่างคุ้มค่า เทพบนฟ้าเทวดาบนดิน
กรีน,206,IMG93,พงศา,ชูแนม,20-12-61,ต้นไม้เป็นทรัพย์สิน : ออกกฎหมายรับรองต้นไม้ให้เป็นหลักทรัพย์โดยการออกบัตรคนรวย TAC ; tree asset card | ที่ทำกินถูกต้องเป็นธรรม : คือการออกมาตรการให้ที่ดินทำกินให้ชอบด้วยกฎหมายแก้ปัญหาคนในเขตป่า 17 ล้านคนด้วยแนวทางให้สิทธิสีเขียว right&green | เกษตรกรรมสุขภาพ : เพื่อคุ้มครองสิทธิเกษตรกรที่ผลิตอาหารสุขภาพให้มีความเท่าทัน ตามอุดมการณ์ ลดอำนาจรัฐ ตัดอำนาจทุน หนุนอำนาจประชาชน | สันติภาพยั่งยืน : การให้สภาประชาชนในโลกดิจิทัลตรวจสอบกำกับรัฐและทุน เช่นการใช้สมการราคากำกับสินค้าให้สัมพันธ์กับราคาพืชผล
