PartyName,PartyTaxCode,PartyLogo,PLFirstName,PLLastName,PartyFoundingDate (dd-mm-yy),PartyPolicy
พลังสหกรณ์,122,IMG28,จักรี,สุจริตธรรม,20-02-55,"มุ่งแก้ไขฟื้นฟูระบบเศรษฐกิจของประเทศ ต่อต้านทุนใหญ่-ผูกขาดเอาเปรียบ ลดช่องว่างรวย-จน จะจัดการที่ดินของรัฐและนายทุนใหญ่มาสร้าง ""นิคมสหกรณ์"" ให้เกษตรกรรายย่อยเข้าทำกินให้เสร็จสิ้นใน 2 ปี/ส่งเสริมการแปรรูปเพิ่มมูลค่าสินค้าการเกษตรให้มีอุปกรณ์การตลาดของสหกรณ์ครบทุกตำบล ภายใน 2 ปี/ทุกหมู่บ้านมีร้านจำหน่ายผลิตผลแบบสหกรณ์ร้านค้า/เงินล้นระบบในสหกรณ์ได้รับการคุ้มครอง จัดตั้งธนาคารสหกรณ์/ปรับปรุงกฎหมายที่ไม่เป็นธรรมและปรับปรุงส่วนราชการที่เป็นอุปสรรค/ส่งเสริมปลูกไม้เศรษฐกิจแบบวนเกษตรปีละ 1 ล้านครอบครัว/สนับสนุนการศึกษาเรียนฟรีทุกระดับจนถึงปริญญาตรี นักศึกษามีงานทำระหว่างเรียน, จัดสวัสดิการแห่งรัฐสร้างสุขอนามัยพื้นฐานภาคประชาชน..ต่อต้านทุจริตคอร์รัปชั่นทุกรูปแบบ"
พลังท้องถิ่นไท,124,IMG29,ชัชวาลล์,คงอุดม,30-03-55,"ลดจำนวนหน่วยงานที่ทับซ้อนภารกิจ เปิดโอกาสให้ประชาชนมีส่วนร่วมในการบริหารราชการแผ่นดิน | การกระจายอำนาจเป็นวาระแห่งชาติ ให้ อปท. และราชการส่วนท้องที่ กำนันผู้ใหญ่บ้าน เป็นกลไกหนุนเสริมภาคประชาชน ยกระดับและพัฒนาคุณภาพชีวิตได้ด้วยตนเอง | จัดตั้งสภาพลเมืองเพื่อเป็นกลไกให้ประชาชนตรวจติดตาม แนะนำนักการเมือง และระบบราชการที่จัดบริการประชาชน | เปลี่ยนการศึกษาไทย ทักษะนำวิชาการ เชื่อมโยงระบบเศรษฐกิจฐานรากสู่เป้าหมายคนรุ่นใหม่มีรายได้ 500,000 บาทต่อปี | สร้างความมั่นคงทางรายได้ แก้จนครัวเรือน แก้จนชุมชน หนุนเสริมสินค้าชุมชน เป็นสินค้าสวัสดิการแห่งรัฐ | สร้างมาตรการแก้ปัญหายาเสพติด จับจริง – ลุยจริง จัดให้มีตำรวจชุมชนตรวจตรา 24 ชม. นำลูกหลานกลับสู่อ้อมกอดพ่อแม่"
พลังเครือข่ายประชาชน,127,IMG30,สขภณ,ธีรชินคุณ,11-07-55,NULL
ถิ่นกาขาวชาววิไล,129,IMG31,ชุมชฎาธาร,หาญณรงค์,07-08-55,ยึดมั่นในการปกครองระบอบประชาธิปไตย อันมีพระมหากษัตริย์ทรงเป็นประมุข | ปัญหาของชาติต้องได้รับการแก้ไขด้วยธรรมวินัย ไตรสิกขา ศีล สมาธิ ปัญญา สนับสนุนส่งเสริมทุกศาสนา | จะส่งเสริมคนให้เป็นมนุษย์และเทวดา จะทำให้สังคมเป็นสังคมนิยมธรรม ให้คนได้รับการศึกษาอย่างทั่วถึง เรียนฟรีตั้งแต่ปฐมวัยจนถึงปริญญาตรี ให้ทุกคนรักษาพยาบาลฟรีทุกโรค ปฏิรูปพลังงาน ผลักดันราคาพืชผลทางการเกษตรให้มีราคาสูงขึ้น | เศรษฐกิจเป็นเศรษฐกิจพอเพียง ตามปรัชญาเศรษฐกิจพอเพียง การเมือง ใช้หลักคุณธรรมนำการเมือง ให้คนยากจนมีที่อยู่อาศัย ที่ทำกิน และเร่งแก้ปัญหาความยากจนและปัญหาจราจร กรุงเทพรถติด เศรษฐกิจย่ำแย่ สิ่งแวดล้อมเป็นพิษ ให้ทุกคนมีชีวิต
รักษ์ผืนป่าไทย,133,IMG32,ดำรงค์,พิเดช,09-01-56,1. เพิ่มป่าไม้ของประเทศจากการปลูกต้นไม้เพื่อสู้ภาวะโลกร้อน ประชาชนจะมีรายได้จากการปลูกต้นไม้ทดแทนโดยทางราชการจะเป็นผู้เพาะกล้าไม้ให้ 2. ที่ดินกรรมสิทธิ์และที่ดินที่รัฐจัดสรรให้สามารถตัดต้นไม้ที่ปลูกได้แต่จะไม่ได้รับเงินชดเชยภาวะโลกร้อน 3. พื้นที่ป่าสงวนแห่งชาติที่ราษฎรยากจนถูกจับให้ยุติคดีและให้เช่าพื้นที่จากกรมป่าไม้ 4. ยกเลิกชนิดพืชหวงห้ามและสัตว์ป่าคุ้มครองที่สามารถเพาะเลี้ยงได้บางชนิด 5. ห้ามใช้วัสดุที่ย่อยสลายได้ยากและให้ใช้พืชผักปลอดสารเคมีในการประกอบอาหารในสถานที่ราชการทุกแห่งทั่วประเทศไทย
ชาติประชาธิปไตยก้าวหน้า,141,IMG33,วิชิต,ดิษฐประสพ,28-06-56,NULL
เพื่อสันติ,142,IMG34,ปราโมทย์,สมะดี,18-07-56,NULL
พลังประเทศไทย,143,IMG35,สรินยา,คงมี,31-07-56,NULL
ไทรักธรรม,144,IMG36,พีระวิทย์,เรื่องลือดลภาค,16-08-56,"พรรคไทรักธรรมมุ่งเน้นให้ประชาชนมีอาชีพเสริมเพิ่มรายได้จากอาชีพหลัก พร้อมจัดหาการตลาดให้อันนำไปสู่การลดภาระหนี้สิน เกิดเป็นเงินออมแก่ประชาชนอีกทั้งยังได้ระบบเงินปันผลโดยสหกรณ์ออนไลน์จากการทำอาชีพเสริม สร้างความเข้าใจแก่เกษตรกรไม่ให้เสียเปรียบนายทุน ให้เกษตรกรได้ลดต้นทุนการผลิต เพิ่มผลผลิตและราคาขายพืชผล อีกทั้งพรรคไทรักธรรมจะเป็นพ่อค้าคนกลางในสินค้าต่าง ๆ จนทำให้ประชาชนผู้บริโภคได้ซื้อในราคาถูก โดยสอนให้ประชาชนรู้จักผลิต รู้จักบริโภค และรู้จักค้าขาย นั้นคือ ""นโยบาย เพื่อปากท้องของประชาชน เมื่อประชาชนอยู่ดีกินดี ทุก ๆ ตำบลประเทศไทยจะพัฒนาและเจริญก้าวหน้าอย่างยั่งยืน"""
เสรีรวมไทย,145,IMG37,เสรีพิศุทธ์,เตมียเวส,29-08-56,หยุดความยากจน ลดความเหลื่อมล้ำของคนในชาติ | หยุดคอรัปชั่น นำงบประมาณมาพัฒนาประเทศ | หยุดปัญหายาเสพติด ขจัดผู้มีอิทธิพลให้สิ้นซาก | หยุดเผด็จการ ปฏิรูปทหาร | หยุดไฟใต้ สร้างสังคมสันติสุขสมานฉันท์ | หยุดสงครามสีเสื้อ สร้างความปรองดอง ก้าวสู่อนาคต
รักษ์ธรรม,147,IMG38,ศักดาวุธ,โกมลประเสริฐ,04-09-56,NULL
รวมพลังไทย,148,IMG39,อำนาจ,สอนทะมาตย์เดชา,11-09-56,NULL
เพื่อชาติ,149,IMG40,สงคราม,กิจเลิศไพโรจน์,18-09-56,เร่งสร้างและธำรงไว้ซึ่งการปกครองในระบอบประชาธิปไตยอันมีพระมหากษัตริย์ทรงเป็นประมุข การบริหารมีหลักธรรมมาภิบาล ขจัดการคอร์รัปชั่น มีสวัสดิการโดยรัฐ พัฒนาเศรษฐกิจทุกภาคส่วนอย่างสมดุลย์ พยุงราคาสินค้าการเกษตร ลดความเหลื่อมล้ำ นำหลักเศรษฐกิจพอเพียงมาเป็นหลักชัยในการพัฒนา เน้นการศึกษาสร้างคน สร้างงาน สร้างสังคมที่เข้มแข็งอบอุ่น ปลอดยาเสพติด ประชาชนมีความสุข มีสิทธิ เสรีภาพ และมีความเสมอภาคเท่าเทียมกัน
เพื่ออนาคต,150,IMG41,พูลเดช,กรรณิการ์,26-09-56,NULL
ชาติไทยสามัคคี,152,IMG42,นพพล,คงบันทึก,11-10-56,NULL
พลังประชาธิปไตย,153,IMG43,พูนพิพัฒน์,นิลรังษี,06-11-56,สร้างรัฐสวัสดิการจากครรภ์มารดาถึงวายชนม์ | มุ่งเน้นการกระจายอำนาจสู่ท้องถิ่น | เพิ่มสวัสดิการ กำนัน ผู้ใหญ่บ้าน อปพร. และ อสม. | ยกระดับโรงพยาบาลส่งเสริมสุขภาพตำบล เป็นโรงพยาบาลให้บริการเต็มรูปแบบ | การศึกษาให้เรียนฟรี จาก ป.1 ถึง ป.ตรี | จัดสรรทรัพยากรของชาติให้เป็นธรรม (ดิน น้ำ ลม ไฟ) | สนับสนุนให้ประชาชนและสื่อมวลชนมีส่วนร่วมในการแสดงออกอย่างเสรีและ เป็นธรรม | ปรับปรุง แก้ไข กฎหมายรัฐธรรมนูญ ให้สอดคล้องกับการเป็นอยู่ของวัฒนธรรมไทย และ นานาชาติ
ภราดรภาพ,154,IMG44,ดำรงดิศ,ดิศกุล,13-11-56,นโยบายพรรคภราดรภาพ ที่สามารถออกแบบได้จากคนไทยทุกคนมีส่วนร่วม เน้นการแก้ปัญหาด้านเศรษฐกิจและสังคม รวมไปถึง การสร้างความเท่าเทียมกัน นโยบายคนรวยต้องช่วยคนจนเพื่อลดความเหลื่อมล้ำ ส่งเสริมความสามัคคีของคนในชาติ พัฒนาประเทศให้มี ความเจริญรุ่งเรืองก้าวหน้าในทุกด้าน สร้างการเมืองไทยให้มีวัฒนธรรมที่ดีงามปราศจากการใส่ร้ายป้ายสี ไม่สร้างความแตกแยก สร้างโอกาสด้านการศึกษาให้ดีขึ้น สนับสนุนการปกครองระบอบประชาธิปไตยอันมีพระมหากษัตริย์ทรงเป็นประมุข
พลังไทยรักชาติ,155,IMG45,สุเทพ,เข้มแข็งปรีชานนท์,28-11-56,"ประชาชนได้รับการบริการจากรัฐมาตรฐานเท่าเทียมกันทั้งหมด ประกันราคาข้าว เกวียนละ 15,000 บ. จะช่วยคนไทยที่ไม่มีที่อยู่อาศัยจะช่วยให้มีที่ของตนเอง คนละ 40 ตรว. ปราบปรามผู้มีอิทธิพลและยาเสพติดเป็นวาระแห่งชาติ อนุรักษ์ทรัพยากรธรรมชาติเป็นวาระแห่งชาติ ส่งเสริมนักวิทยาศาสตร์ในการคิดสร้างผลผลิต และคิดค้นทางด้านต่าง ๆ อย่างจริงจัง ครอบครัวคนจนเรียนฟรี อนุบาล ม.ปลาย กู้เรียนจบปริญญาไม่ต้องเสียดอกเบี้ย รักษาฟรีทุกโรค สำหรับคนจนและไม่มีเงิน ยื่นบัตรประชาชนขอรักษาฟรีได้เลย ประกันราคาผลิตผลทางการเกษตรทุกชนิดให้ได้ในราคาที่ต้องมีกำไร 3,000 – 5,000 บ. ขึ้นไป"
เมืองไทยของเรา,156,IMG46,พิษณุ,พุทธสิม,28-11-56,NULL
เพื่อชีวิตใหม่,157,IMG47,ทองประเสริฐ,จันทรอัมพร,20-12-56,1. สนับสนุนให้มีโครงการอาหารกลางวันแก่นักเรียนนักศึกษาภาคบังคับโดยไม่มีค่าใช้จ่ายใดๆ 2. สนับสนุนให้มีโครงการรักษาในโรงพยาบาลของรัฐทุกแห่ง ทุกกรณี โดยไม่มีค่าใช้จ่ายใดๆ 3. สนับสนุนโครงการจัดสรรที่ดินแก่ประชาชนที่ไร้ที่ทำกิน ออกโฉนดที่ดินแก่ที่ครอบครองอย่างเสมอภาค 4. สนับสนุนให้ตั้งกองทุนทำปุ๋ยชีวภาพแจกจ่ายกันเองในกลุ่มเกษตรกรทุกภาคส่วน 5. สนับสนุนให้ตั้งคลินิกแก้จน ให้คำแนะนำปรึกษาแก้ไขปัญหาแก่ประชาชนทุกหมู่เหล่า 6. สนับสนุนให้มีการติดตั้งแผงโซล่าเซลล์ทุกครัวเรือน
เงินเดือนประชาชน,158,IMG48,กานท์ชญา,เทียนแก้ว,25-12-56,NULL
ปฏิรูปไทย,160,IMG49,พัฒนศักดิ์,ปิ่นศิริ,25-02-57,NULL
คนธรรมดาแห่งประเทศไทย,161,IMG50,ธนพร,ศรียากูล,05-03-57,เสนอนโยบายการปฏิรูปเชิงโครงสร้าง เพื่อนำพาประเทศก้าวสู่ความเป็นเสรีประชาธิปไตยอันเป็นสากล ด้วยการแก้ไขปรับปรุงกฎหมายที่ไม่สอดคล้องกับกาลสมัยและหลักนิติธรรม ส่งเสริมให้การกระจายอำนาจการปกครอง เพื่อเพิ่มประสิทธิภาพของรัฐในการตอบสนองความต้องการของประชาชน เพิ่มขีดความสามารถทางเศรษฐกิจและการแข่งขันของประเทศ ด้วยการขจัดการผูกขาดทางการค้า และส่งเสริมการทำเกษตรกรรมแบบอินทรีย์ ส่งเสริมความมั่นคงในชีวิตของประชาชน ด้วยการแก้ไขปัญหาที่ดินทำกิน และรับรองความเสมอภาคระหว่างบุคคลให้เท่าเทียมกัน
รักท้องถิ่นไทย,162,IMG51,จริญญา,รัตน์มณีบดีเดช,08-04-57,NULL
ผึ้งหลวง,164,IMG52,ก้องถพ,วังสุนทร,01-05-57,"นโยบายกองทุนสร้างเศรษฐกิจและสังคม หมู่บ้าน / ชุมชนละ 20 ล้าน | นโยบายกองทุนพัฒนาเกษตรกรไทยสู่สากล | นโยบายปลดหนี้ - บำนาญประชาชน ด้วยไม้เศรษฐกิจ ไผ่กิมซุง 200,000 ล้าน | นโยบายประเทศไทย น้ำไม่ท่วม ไม่แล้ง | นโยบายปรับราคาประเมินที่ดินเกษตรกรรมไร่ละ 1 ล้าน | นโยบาย 1 อำเภอ 1 โรงงานแปรรูปการเกษตร 200 ล้าน | นโยบายประกันราคาสินค้าการเกษตรล่วงหน้า"
มหาประชาชน,165,IMG53,มลฤดี,แย้มเกษสุคนธ์,06-05-57,NULL
เพื่อสหกรณ์ไทย,167,IMG54,วิเชียร,ปิ่ติสิทธิ์,16-05-57,พรรคเพื่อสหกรณ์ไทย“ปฎิรูปประเทศไทยด้วยวิถีสหกรณ์” แนวนโยบาย ( สร้างเกษตรและสถาบันเกษตรกรให้เข้มแข็งด้วยระบบสหกรณ์ตั้งแต่ระดับตำบลถึงระดับชาติ | สร้างสวัสดิการและการเงินชุมชนด้วยระบบสหกรณ์ | สร้างเศรษฐกิจฐานรากให้ยั่งยืนด้วยระบบสหกรณ์ “เกษตรกรอยู่รอด สวัสดิการชุมชนเข้มแข็ง เศรษฐกิจฐานรากยั่งยืน”)
เอกราชไทย,168,IMG55,กัมปนาท,เพิ่มสุข,19-05-57,NULL
ประชาธิปไตยเพื่อประชาชน,169,IMG56,ประมวล,พิมพ์เสน,21-05-57,อำนาจในการปกครองเป็นของประชาชน ระบบเศรษฐกิจใช้หลักสหกรณ์และหลักเศรษฐกิจพอเพียง สร้างสังคม บวร ด้วยหลักพุทธธรรมและรักษาหลักวินัยบัญญัติของพระพุทธเจ้า พัฒนาฝีมือแรงงานให้ตรงและเพียงพอต่อการจ้างงาน คุ้มครองสิทธิเสรีภาพและสวัสดิการแรงงานทั้งขณะจ้างงานและวัยเกษียณ ผู้สูงวัยมีคุณภาพด้วยภูมิปัญญาไทย จัดการศึกษาทั้งในระบบและตลอดชีพ คนไทยต้องมีทักษะในวิชาชีพหลายประเภท การสาธารณสุขให้ใช้ระบบรัฐสวัสดิการ คนไทยสุขภาพดีถ้วนหน้าด้วยกีฬาและสมุนไพรไทย ใช้ระบบไกล่เกลี่ยเบื้องต้น ขจัดกระบวนการยุติธรรมสองมาตรฐาน ยกเลิกการเกณฑ์ทหาร นำทรัพยากรพลังงานของชาติกลับมาเป็นของประชาชน ส่งเสริมนโยบายการรักษาป่าด้วยระบบธนาคารต้นไม้ นำพาประเทศไทยให้เป็นผู้นำในองค์กรระหว่างประเทศฯ
